{
  "identity": {
    "case_id": "CANDIDATE-09",
    "status": "candidate",
    "revision": 1,
    "approved_by_user": false,
    "category": "image_explanation"
  },
  "task": {
    "base_operation": "EXPLAIN",
    "augmentation": "TEACHING",
    "genre": "tutorial",
    "audience": "zero_prior_knowledge",
    "media": [
      "markdown",
      "image"
    ],
    "components": [
      "IMAGE",
      "TEXT"
    ],
    "request": "把图中每个影响理解的元素讲清楚，并区分可见事实、背景知识和图中没有证明的内容"
  },
  "source": {
    "material_type": "image",
    "content": {
      "path": "evals/candidate/assets/CANDIDATE-09-clock-crossing.svg",
      "effective_elements": [
        "蓝色 clk_a 时钟域",
        "绿色 clk_b 时钟域",
        "control 圆形信号源",
        "从左向右的箭头",
        "跨时钟域标签",
        "FF1 方框",
        "FF2 方框",
        "两级触发器同步器标签",
        "图中没有展示多比特总线提示"
      ]
    },
    "references": [
      {
        "id": "REF-001",
        "kind": "fixture_background",
        "content": "时钟域表示由同一时钟控制的一组电路；触发器在时钟边沿采样输入；两级触发器同步器常用于降低单比特控制信号的亚稳态传播风险，但不能自动保证多比特数据一致"
      }
    ]
  },
  "semantics": {
    "source_atoms": [
      {
        "id": "ATOM-001",
        "source_locator": "左侧蓝色区域",
        "claim": "control 信号起点位于 clk_a 时钟域",
        "provenance_type": "SOURCE"
      },
      {
        "id": "ATOM-002",
        "source_locator": "中间箭头",
        "claim": "control 信号从左向右跨越时钟域",
        "provenance_type": "SOURCE"
      },
      {
        "id": "ATOM-003",
        "source_locator": "FF1 和 FF2",
        "claim": "信号依次经过两个触发器",
        "provenance_type": "SOURCE"
      },
      {
        "id": "ATOM-004",
        "source_locator": "右侧绿色区域",
        "claim": "FF2 输出位于 clk_b 时钟域",
        "provenance_type": "SOURCE"
      },
      {
        "id": "ATOM-005",
        "source_locator": "底部橙色提示",
        "claim": "图中没有展示多比特总线",
        "provenance_type": "SOURCE"
      }
    ],
    "background_atoms": [
      {
        "id": "BG-001",
        "source_reference": "REF-001",
        "purpose": "解释时钟域和触发器",
        "claim": "时钟域由同一时钟控制，触发器在时钟边沿采样输入",
        "provenance_type": "EXTERNAL_BACKGROUND"
      },
      {
        "id": "BG-002",
        "source_reference": "REF-001",
        "purpose": "解释两级同步器的用途和边界",
        "claim": "两级同步器降低单比特控制信号的亚稳态传播风险，但不能自动保证多比特数据一致",
        "provenance_type": "EXTERNAL_BACKGROUND"
      }
    ],
    "must_preserve": [
      "信号方向从 clk_a 到 clk_b",
      "先经过 FF1 再经过 FF2",
      "图中没有展示多比特总线",
      "颜色只用于区分区域"
    ],
    "must_not_invent": [
      "电路已经通过仿真",
      "电路已经在板卡上验证",
      "两级同步器消除全部风险",
      "多比特总线也适用"
    ],
    "inference_atoms": []
  },
  "candidate": {
    "answer": "这张图展示一个名为 `control` 的单比特控制信号怎样从 `clk_a` 时钟域进入 `clk_b` 时钟域；阅读顺序从左向右\n\n理解图片以前需要知道：时钟域是由同一时钟控制的一组电路；触发器会在时钟边沿采样输入；信号进入另一个时钟域时，接收端可能在不稳定时刻采样\n\n图中的有效元素分别表示：\n\n- 蓝色区域：`clk_a` 时钟域；它是 `control` 信号的起点\n- 白色圆形 `control`：需要跨越时钟域的单比特控制信号\n- 中间黑色箭头：信号从左向右传递，箭头上的“跨时钟域”说明它离开 `clk_a` 并进入 `clk_b`\n- 灰色 `FF1`：`clk_b` 一侧的第一级触发器；它先接收跨域信号\n- 灰色 `FF2`：第二级触发器；它接收 `FF1` 的输出\n- 绿色区域：`clk_b` 时钟域；`FF2` 的输出在这个时钟域中继续使用\n- 蓝色和绿色：只用于区分两个时钟域，图中没有赋予颜色额外的成功或风险等级\n- 橙色提示：图中没有展示多比特总线，因此不能把这张图直接解释成多比特数据跨域方案\n\n从连接关系可以直接得到：`control` 先经过 `FF1`，再经过 `FF2`；背景资料说明，这种两级触发器结构常用于降低单比特控制信号把亚稳态继续传播到后续逻辑的风险\n\n这张图只说明结构和信号方向；它没有提供时钟频率、复位方式、仿真结果、板卡测试或故障率数据，因此不能证明电路已经验证，也不能证明风险已经完全消除",
    "support_map": [
      {
        "sentence": 1,
        "supports": [
          "ATOM-001",
          "ATOM-002",
          "ATOM-003",
          "ATOM-004"
        ],
        "role": "image_overview"
      },
      {
        "sentence": 2,
        "supports": [
          "BG-001"
        ],
        "role": "explanatory_background"
      },
      {
        "sentence": 3,
        "supports": [
          "ATOM-001",
          "ATOM-002",
          "ATOM-003",
          "ATOM-004",
          "ATOM-005"
        ],
        "role": "component_explanation"
      },
      {
        "sentence": 4,
        "supports": [
          "ATOM-002",
          "ATOM-003",
          "BG-002"
        ],
        "role": "relation_and_background"
      },
      {
        "sentence": 5,
        "supports": [
          "ATOM-005",
          "BG-002"
        ],
        "role": "evidence_limit"
      }
    ],
    "self_claims": []
  },
  "review": {
    "questions": [
      "图中每个有效元素是否都有解释落点",
      "可见事实、背景知识和证据边界是否分得清",
      "解释是否足够让零基础读者知道从哪里开始看",
      "逐项覆盖是否过长或仍有遗漏"
    ],
    "privacy": {
      "status": "public_safe",
      "basis": "图片和内容均为本仓库合成测试资产"
    }
  }
}
