{
  "identity": {
    "case_id": "CANDIDATE-08",
    "status": "candidate",
    "revision": 1,
    "approved_by_user": false,
    "category": "teaching_transform"
  },
  "task": {
    "base_operation": "TRANSFORM",
    "augmentation": "TEACHING",
    "genre": "api_tutorial",
    "audience": "zero_prior_knowledge",
    "media": [
      "markdown"
    ],
    "components": [
      "TEXT",
      "CODE",
      "FLOWCHART"
    ],
    "request": "完整保留接口规则，并从零解释幂等键怎样防止重复创建订单"
  },
  "source": {
    "material_type": "text",
    "content": "创建订单时必须发送 `Idempotency-Key`。24 小时内，使用同一键重复发送相同请求时，服务返回原始 `order_id`，不会创建第二个订单。使用同一键发送不同请求体时，服务返回 HTTP `409`。键在 24 小时后失效。",
    "references": [
      {
        "id": "REF-001",
        "kind": "fixture_background",
        "content": "幂等键是客户端为一次业务操作生成的唯一标识；服务保存键与首次请求结果的对应关系；HTTP 409 表示当前请求与服务器已经保存的状态发生冲突"
      }
    ]
  },
  "semantics": {
    "source_atoms": [
      {
        "id": "ATOM-001",
        "source_locator": "第 1 句",
        "claim": "创建订单必须发送 Idempotency-Key",
        "provenance_type": "SOURCE"
      },
      {
        "id": "ATOM-002",
        "source_locator": "第 2 句",
        "claim": "24 小时内同键同请求返回原 order_id 且不创建第二个订单",
        "provenance_type": "SOURCE"
      },
      {
        "id": "ATOM-003",
        "source_locator": "第 3 句",
        "claim": "同键不同请求体返回 HTTP 409",
        "provenance_type": "SOURCE"
      },
      {
        "id": "ATOM-004",
        "source_locator": "第 4 句",
        "claim": "键在 24 小时后失效",
        "provenance_type": "SOURCE"
      }
    ],
    "background_atoms": [
      {
        "id": "BG-001",
        "source_reference": "REF-001",
        "purpose": "解释幂等键",
        "claim": "幂等键标识一次业务操作，服务保存它与首次结果的对应关系",
        "provenance_type": "EXTERNAL_BACKGROUND"
      },
      {
        "id": "BG-002",
        "source_reference": "REF-001",
        "purpose": "解释 HTTP 409",
        "claim": "HTTP 409 表示请求与服务器已有状态冲突",
        "provenance_type": "EXTERNAL_BACKGROUND"
      }
    ],
    "must_preserve": [
      "必须发送 Idempotency-Key",
      "24 小时窗口",
      "同键同请求返回原 order_id",
      "不创建第二个订单",
      "同键不同请求体返回 409",
      "24 小时后失效"
    ],
    "must_not_invent": [
      "服务永久保存键",
      "409 表示服务器故障",
      "同键可以用于多个不同订单",
      "24 小时后仍保证返回原订单"
    ],
    "inference_atoms": []
  },
  "candidate": {
    "answer": "## 1. 幂等键是什么\n\n`Idempotency-Key` 幂等键是客户端为一次创建订单操作生成的唯一标识；它的用途是让服务认出重复提交仍然属于同一次业务操作，避免网络重试创建两个订单\n\n## 2. 服务怎样处理请求\n\n```mermaid\nflowchart TD\n    A[客户端发送订单内容和 Idempotency-Key] --> B{服务是否见过这个键}\n    B -->|没有| C[创建订单并保存 order_id]\n    B -->|见过且请求体相同| D[返回原始 order_id 不创建第二个订单]\n    B -->|见过但请求体不同| E[返回 HTTP 409 冲突]\n    C --> F[键和结果保留 24 小时]\n    D --> F\n    E --> F\n```\n\n图 1. 幂等键在 24 小时窗口内的处理流程\n\n第一次请求使用新键时，服务创建订单并返回 `order_id`；24 小时内，如果网络重试使用同一键和相同请求体，服务返回第一次创建的 `order_id`，不会创建第二个订单；如果同一键对应的请求体发生变化，服务返回 HTTP 超文本传输协议（Hypertext Transfer Protocol）状态码 `409`，表示新请求与该键已经保存的内容冲突\n\n## 3. 使用边界\n\n创建订单时必须发送幂等键；同一次业务操作的重试必须复用同一个键和同一份请求体；键在 24 小时后失效，原文没有保证失效后再次提交仍会返回原订单",
    "support_map": [
      {
        "sentence": 1,
        "supports": [
          "ATOM-001",
          "BG-001"
        ],
        "role": "source_restatement_and_teaching"
      },
      {
        "sentence": 2,
        "supports": [
          "ATOM-001",
          "ATOM-002",
          "ATOM-003",
          "ATOM-004",
          "BG-001",
          "BG-002"
        ],
        "role": "component_explanation"
      },
      {
        "sentence": 3,
        "supports": [
          "ATOM-002",
          "ATOM-003",
          "BG-002"
        ],
        "role": "source_restatement_and_teaching"
      },
      {
        "sentence": 4,
        "supports": [
          "ATOM-001",
          "ATOM-002",
          "ATOM-004"
        ],
        "role": "scope_explanation"
      }
    ],
    "self_claims": []
  },
  "review": {
    "questions": [
      "零基础读者是否能理解键、请求体、order_id 和 409 的关系",
      "流程图是否准确覆盖首次请求、相同重试和冲突分支",
      "24 小时边界是否清楚且没有扩大承诺",
      "说明是否过长或仍缺少实际使用细节"
    ],
    "privacy": {
      "status": "public_safe",
      "basis": "订单接口为合成教学材料，不对应真实业务"
    }
  }
}
