{
  "identity": {
    "case_id": "CANDIDATE-03",
    "status": "candidate",
    "revision": 1,
    "approved_by_user": false,
    "category": "glossed_transform"
  },
  "task": {
    "base_operation": "TRANSFORM",
    "augmentation": "GLOSS",
    "genre": "readme",
    "audience": "zero_prior_knowledge",
    "media": [
      "markdown"
    ],
    "components": [
      "TEXT",
      "CODE"
    ],
    "request": "改写快速检查说明，并解释新手完成操作必须知道的术语"
  },
  "source": {
    "material_type": "text",
    "content": "运行 `npm run check`。发现失效链接时，命令以退出码 `2` 结束，CI 会把本次检查标记为失败。",
    "references": [
      {
        "id": "REF-001",
        "kind": "fixture_glossary",
        "content": "npm 是项目调用已登记脚本的命令行工具；CI 是在提交代码后自动运行检查的持续集成流程；退出码是命令结束时返回给操作系统的数字状态"
      }
    ]
  },
  "semantics": {
    "source_atoms": [
      {
        "id": "ATOM-001",
        "source_locator": "第 1 句",
        "claim": "用户需要运行 npm run check",
        "provenance_type": "SOURCE"
      },
      {
        "id": "ATOM-002",
        "source_locator": "第 2 句前半",
        "claim": "失效链接会使命令返回退出码 2",
        "provenance_type": "SOURCE"
      },
      {
        "id": "ATOM-003",
        "source_locator": "第 2 句后半",
        "claim": "CI 会把检查标记为失败",
        "provenance_type": "SOURCE"
      }
    ],
    "background_atoms": [
      {
        "id": "BG-001",
        "source_reference": "REF-001",
        "purpose": "解释 npm",
        "claim": "npm 用于调用项目已登记的脚本",
        "provenance_type": "EXTERNAL_BACKGROUND"
      },
      {
        "id": "BG-002",
        "source_reference": "REF-001",
        "purpose": "解释退出码",
        "claim": "退出码是命令结束时返回的数字状态",
        "provenance_type": "EXTERNAL_BACKGROUND"
      },
      {
        "id": "BG-003",
        "source_reference": "REF-001",
        "purpose": "解释 CI",
        "claim": "CI 会在代码提交后自动运行检查",
        "provenance_type": "EXTERNAL_BACKGROUND"
      }
    ],
    "must_preserve": [
      "命令 npm run check",
      "失效链接",
      "退出码 2",
      "CI 标记失败"
    ],
    "must_not_invent": [
      "命令会自动修复链接",
      "退出码 2 表示所有类型的错误",
      "CI 已经配置完成"
    ],
    "inference_atoms": []
  },
  "candidate": {
    "answer": "运行下面的命令检查项目链接\n\n```powershell\nnpm run check # npm 会调用项目中已经登记的 check 检查脚本；命令结束后会返回检查结果\n```\n\n`npm` 是项目调用已登记脚本的命令行工具；如果检查发现失效链接，命令会以退出码 `2` 结束；退出码是命令返回给操作系统的数字状态，`2` 让本地脚本和 CI 持续集成流程识别本次检查失败；CI 会在代码提交后自动运行同一类检查，但这段说明没有证明当前项目已经启用 CI",
    "support_map": [
      {
        "sentence": 1,
        "supports": [
          "ATOM-001",
          "BG-001"
        ],
        "role": "source_restatement_and_gloss"
      },
      {
        "sentence": 2,
        "supports": [
          "ATOM-001",
          "ATOM-002",
          "ATOM-003",
          "BG-001",
          "BG-002",
          "BG-003"
        ],
        "role": "source_restatement_and_gloss"
      }
    ],
    "self_claims": []
  },
  "review": {
    "questions": [
      "新手是否能理解 npm、退出码 2 和 CI 分别是什么",
      "解释是否保持了原文的失败关系，没有声称自动修复",
      "代码注释是否说明了命令、原因和可观察结果"
    ],
    "privacy": {
      "status": "public_safe",
      "basis": "命令和术语均为公开通用示例，不含真实仓库信息"
    }
  }
}
