{
  "identity": {
    "case_id": "CANDIDATE-12",
    "status": "candidate",
    "revision": 1,
    "approved_by_user": false,
    "category": "multi_turn"
  },
  "task": {
    "base_operation": "TRANSFORM",
    "augmentation": "GLOSS",
    "genre": "customer_status",
    "audience": "zero_prior_knowledge",
    "media": [
      "chat"
    ],
    "components": [
      "TEXT"
    ],
    "request": "结合两轮要求生成客户状态说明，保留状态码和任务标识，不承诺完成时间"
  },
  "source": {
    "material_type": "multi_turn",
    "content": {
      "turn_1_material": "状态码 31 表示队列已经接收任务，处理尚未开始；任务标识 JOB-204 用于查询；自动重试上限为 3 次。",
      "turn_1_request": "把状态说明写给客户",
      "turn_2_request": "客户完全不懂技术；保留状态码 31 和 JOB-204；不要承诺完成时间；增加客户下一步"
    },
    "references": [
      {
        "id": "REF-001",
        "kind": "fixture_glossary",
        "content": "队列用于按顺序等待处理任务；任务标识用于查询同一任务；自动重试表示系统在一次处理失败后再次尝试，但重试上限不等于一定会成功"
      }
    ]
  },
  "semantics": {
    "source_atoms": [
      {
        "id": "ATOM-001",
        "source_locator": "turn_1_material 第 1 项",
        "claim": "状态码 31 表示队列已接收任务，但处理尚未开始",
        "provenance_type": "SOURCE"
      },
      {
        "id": "ATOM-002",
        "source_locator": "turn_1_material 第 2 项",
        "claim": "JOB-204 用于查询任务",
        "provenance_type": "SOURCE"
      },
      {
        "id": "ATOM-003",
        "source_locator": "turn_1_material 第 3 项",
        "claim": "自动重试上限为 3 次",
        "provenance_type": "SOURCE"
      },
      {
        "id": "ATOM-004",
        "source_locator": "turn_2_request",
        "claim": "保留状态码和任务标识，不承诺完成时间并增加客户下一步",
        "provenance_type": "USER_SUPPLIED"
      }
    ],
    "background_atoms": [
      {
        "id": "BG-001",
        "source_reference": "REF-001",
        "purpose": "解释队列",
        "claim": "队列让任务按照系统安排等待处理",
        "provenance_type": "EXTERNAL_BACKGROUND"
      },
      {
        "id": "BG-002",
        "source_reference": "REF-001",
        "purpose": "解释自动重试边界",
        "claim": "失败后系统可以再次尝试，但重试上限不保证成功",
        "provenance_type": "EXTERNAL_BACKGROUND"
      }
    ],
    "must_preserve": [
      "状态码 31",
      "已接收但尚未开始",
      "JOB-204",
      "查询用途",
      "最多自动重试 3 次",
      "不承诺完成时间",
      "客户下一步"
    ],
    "must_not_invent": [
      "任务正在处理",
      "任务最终会成功",
      "具体完成时间",
      "客户必须重新提交"
    ],
    "inference_atoms": []
  },
  "candidate": {
    "answer": "您的任务已经进入等待处理队列，当前状态码为 `31`；这个状态表示系统已经接收任务，但实际处理尚未开始\n\n任务标识为 `JOB-204`；它用于查询同一个任务的后续状态，请保留该标识，无需重复提交\n\n如果后续处理失败，系统最多会自动重试 `3` 次；重试次数表示系统再次尝试的上限，不代表任务一定成功，也不能据此确定完成时间\n\n您现在不需要执行其他操作；需要查看进度时，请使用 `JOB-204` 查询",
    "support_map": [
      {
        "sentence": 1,
        "supports": [
          "ATOM-001",
          "BG-001"
        ],
        "role": "source_restatement_and_gloss"
      },
      {
        "sentence": 2,
        "supports": [
          "ATOM-002",
          "ATOM-004"
        ],
        "role": "source_restatement_and_next_step"
      },
      {
        "sentence": 3,
        "supports": [
          "ATOM-003",
          "ATOM-004",
          "BG-002"
        ],
        "role": "source_restatement_and_limit"
      },
      {
        "sentence": 4,
        "supports": [
          "ATOM-002",
          "ATOM-003",
          "ATOM-004"
        ],
        "role": "next_step"
      }
    ],
    "self_claims": []
  },
  "review": {
    "questions": [
      "第二轮要求是否正确覆盖并且没有丢失第一轮事实",
      "客户是否能理解状态码、任务标识、队列和重试上限",
      "下一步是否可执行且没有承诺完成时间",
      "最后一句是否增加了原材料没有授权的处理建议"
    ],
    "privacy": {
      "status": "public_safe",
      "basis": "状态码、任务标识和业务流程均为合成材料"
    }
  }
}
