{
  "identity": {
    "case_id": "CANDIDATE-06",
    "status": "candidate",
    "revision": 1,
    "approved_by_user": false,
    "category": "explanatory_translation"
  },
  "task": {
    "base_operation": "TRANSLATE",
    "augmentation": "EXPLANATORY",
    "genre": "legal_notice",
    "audience": "general_reader",
    "media": [
      "markdown"
    ],
    "components": [
      "TEXT"
    ],
    "request": "完整翻译条款，并解释普通读者容易混淆的暂停、终止和费用关系"
  },
  "source": {
    "material_type": "text",
    "content": "The Supplier may suspend access if an invoice remains unpaid for more than 15 days after its due date. Suspension does not terminate this Agreement or waive accrued fees. The Supplier must restore access within two business days after receiving full payment.",
    "references": [
      {
        "id": "REF-001",
        "kind": "fixture_glossary",
        "content": "在本合成条款中，suspend access 表示暂时停止服务访问；terminate the Agreement 表示结束协议；accrued fees 表示已经产生的费用；business day 表示合同采用的工作日口径，具体节假日范围需要由合同其他条款确定"
      }
    ]
  },
  "semantics": {
    "source_atoms": [
      {
        "id": "ATOM-001",
        "source_locator": "第 1 句",
        "claim": "发票到期超过 15 天仍未付款时，供应商可以暂停访问",
        "provenance_type": "SOURCE"
      },
      {
        "id": "ATOM-002",
        "source_locator": "第 2 句",
        "claim": "暂停访问不终止协议，也不免除已经产生的费用",
        "provenance_type": "SOURCE"
      },
      {
        "id": "ATOM-003",
        "source_locator": "第 3 句",
        "claim": "供应商收到全部付款后必须在两个工作日内恢复访问",
        "provenance_type": "SOURCE"
      }
    ],
    "background_atoms": [
      {
        "id": "BG-001",
        "source_reference": "REF-001",
        "purpose": "区分暂停和终止",
        "claim": "暂停访问是暂时停止服务，终止协议是结束协议关系",
        "provenance_type": "EXTERNAL_BACKGROUND"
      },
      {
        "id": "BG-002",
        "source_reference": "REF-001",
        "purpose": "解释已产生费用和工作日边界",
        "claim": "已产生费用不会因暂停而消失，工作日范围需要由合同其他条款确定",
        "provenance_type": "EXTERNAL_BACKGROUND"
      }
    ],
    "must_preserve": [
      "超过 15 天",
      "供应商可以而非必须暂停",
      "暂停不终止协议",
      "费用不免除",
      "收到全部付款后两个工作日内恢复"
    ],
    "must_not_invent": [
      "供应商必须暂停",
      "暂停自动终止协议",
      "工作日包含哪些节假日",
      "部分付款足以恢复访问"
    ],
    "inference_atoms": []
  },
  "candidate": {
    "answer": "完整翻译如下\n\n如果发票在到期日后超过 15 天仍未付款，供应商可以暂停客户访问服务；暂停访问不会终止本协议，也不会免除已经产生的费用；供应商收到全部付款后，必须在两个工作日内恢复访问\n\n这里的暂停访问表示暂时停止使用服务，协议本身仍然有效；终止协议则表示结束协议关系，两者的法律效果不同；已经产生的费用仍需支付；两个工作日从供应商收到全部付款后开始计算，但哪些日期属于工作日需要按照合同其他条款确认",
    "support_map": [
      {
        "sentence": 1,
        "supports": [
          "ATOM-001",
          "ATOM-002",
          "ATOM-003"
        ],
        "role": "source_restatement"
      },
      {
        "sentence": 2,
        "supports": [
          "ATOM-002",
          "BG-001",
          "BG-002"
        ],
        "role": "explanatory_background"
      }
    ],
    "self_claims": []
  },
  "review": {
    "questions": [
      "可以、必须、超过 15 天和两个工作日的强度是否保持",
      "暂停、终止和已产生费用之间的关系是否更清楚",
      "工作日边界是否诚实保留为需要查合同其他条款"
    ],
    "privacy": {
      "status": "public_safe",
      "basis": "条款和词汇说明均为合成材料，不构成真实法律意见"
    }
  }
}
