{
  "identity": {
    "case_id": "CANDIDATE-05",
    "status": "candidate",
    "revision": 1,
    "approved_by_user": false,
    "category": "explanatory_translation"
  },
  "task": {
    "base_operation": "TRANSLATE",
    "augmentation": "EXPLANATORY",
    "genre": "academic_paper",
    "audience": "zero_prior_knowledge",
    "media": [
      "markdown"
    ],
    "components": [
      "TEXT"
    ],
    "request": "完整翻译，并补充零基础读者理解实验范围所需的背景"
  },
  "source": {
    "material_type": "text",
    "content": "A two-flop synchronizer was inserted on each single-bit control signal crossing from clk_a to clk_b. The experiment did not evaluate multi-bit buses or asynchronous reset deassertion.",
    "references": [
      {
        "id": "REF-001",
        "kind": "fixture_background",
        "content": "时钟域跨越发生在信号从一个时钟控制区域进入另一个时钟控制区域时；两级触发器同步器常用于降低单比特控制信号在接收时钟域中传播亚稳态的风险，但它不能自动保证多比特数据同时保持一致，也不能代替复位释放检查"
      }
    ]
  },
  "semantics": {
    "source_atoms": [
      {
        "id": "ATOM-001",
        "source_locator": "第 1 句",
        "claim": "每个从 clk_a 到 clk_b 的单比特控制信号都插入了两级触发器同步器",
        "provenance_type": "SOURCE"
      },
      {
        "id": "ATOM-002",
        "source_locator": "第 2 句前半",
        "claim": "实验没有评估多比特总线",
        "provenance_type": "SOURCE"
      },
      {
        "id": "ATOM-003",
        "source_locator": "第 2 句后半",
        "claim": "实验没有评估异步复位释放",
        "provenance_type": "SOURCE"
      }
    ],
    "background_atoms": [
      {
        "id": "BG-001",
        "source_reference": "REF-001",
        "purpose": "解释时钟域跨越",
        "claim": "时钟域跨越表示信号进入另一个时钟控制区域",
        "provenance_type": "EXTERNAL_BACKGROUND"
      },
      {
        "id": "BG-002",
        "source_reference": "REF-001",
        "purpose": "解释两级同步器的用途和边界",
        "claim": "两级同步器用于降低单比特控制信号的亚稳态传播风险，但不能自动解决多比特一致性或复位释放问题",
        "provenance_type": "EXTERNAL_BACKGROUND"
      }
    ],
    "must_preserve": [
      "two-flop 对应两级触发器",
      "单比特控制信号",
      "clk_a 到 clk_b 的方向",
      "未评估多比特总线",
      "未评估异步复位释放"
    ],
    "must_not_invent": [
      "实验证明所有时钟域跨越安全",
      "多比特总线已经验证",
      "异步复位已经验证"
    ],
    "inference_atoms": []
  },
  "candidate": {
    "answer": "原文完整翻译如下\n\n研究人员在每个从 `clk_a` 时钟域进入 `clk_b` 时钟域的单比特控制信号上加入了两级触发器同步器；这项实验没有评估多比特总线，也没有评估异步复位解除过程\n\n理解这一结论需要知道：时钟域表示由同一时钟控制的一组电路；信号从一个时钟域进入另一个时钟域时，接收端可能在不稳定时刻采样信号；两级触发器同步器常用于降低单比特控制信号把这种不稳定状态继续传播的风险\n\n这项结果的适用范围只包括原文处理的单比特控制信号；多比特数据需要考虑各位是否同时保持一致，异步复位解除还需要单独检查释放时序；这些背景用于说明原文为什么明确排除了两类对象，不表示作者已经完成相应验证",
    "support_map": [
      {
        "sentence": 1,
        "supports": [
          "ATOM-001",
          "ATOM-002",
          "ATOM-003"
        ],
        "role": "source_restatement"
      },
      {
        "sentence": 2,
        "supports": [
          "BG-001",
          "BG-002"
        ],
        "role": "explanatory_background"
      },
      {
        "sentence": 3,
        "supports": [
          "ATOM-001",
          "ATOM-002",
          "ATOM-003",
          "BG-002"
        ],
        "role": "scope_explanation"
      }
    ],
    "self_claims": []
  },
  "review": {
    "questions": [
      "原文的方向、对象和两个未评估范围是否全部保留",
      "补充背景是否帮助理解，同时没有伪装成作者结论",
      "零基础读者是否仍需要解释时钟、触发器或复位"
    ],
    "privacy": {
      "status": "public_safe",
      "basis": "论文片段和背景均为合成测试材料"
    }
  }
}
