{
  "identity": {
    "case_id": "CANDIDATE-07",
    "status": "candidate",
    "revision": 1,
    "approved_by_user": false,
    "category": "teaching_transform"
  },
  "task": {
    "base_operation": "TRANSFORM",
    "augmentation": "TEACHING",
    "genre": "engineering_status",
    "audience": "zero_prior_knowledge",
    "media": [
      "markdown"
    ],
    "components": [
      "TEXT",
      "FLOWCHART"
    ],
    "request": "保留全部工程状态，把它改写成没有 FPGA 经验的人也能判断是否可以发布的说明"
  },
  "source": {
    "material_type": "text",
    "content": "软件综合和时序分析已通过；位流已经生成；开发板尚未上电，外设和物理接口未测试；当前结果不能批准产品发布。",
    "references": [
      {
        "id": "REF-001",
        "kind": "fixture_background",
        "content": "综合把硬件设计转换成器件可以实现的逻辑结构；时序分析检查设计在设定时钟约束下是否满足时间要求；位流是写入 FPGA 的配置文件；开发板测试会引入真实供电、时钟、外设和物理接口条件"
      }
    ]
  },
  "semantics": {
    "source_atoms": [
      {
        "id": "ATOM-001",
        "source_locator": "分号第 1 项",
        "claim": "软件综合和时序分析已经通过",
        "provenance_type": "SOURCE"
      },
      {
        "id": "ATOM-002",
        "source_locator": "分号第 2 项",
        "claim": "位流已经生成",
        "provenance_type": "SOURCE"
      },
      {
        "id": "ATOM-003",
        "source_locator": "分号第 3 项",
        "claim": "开发板尚未上电，外设和物理接口未测试",
        "provenance_type": "SOURCE"
      },
      {
        "id": "ATOM-004",
        "source_locator": "分号第 4 项",
        "claim": "当前结果不能批准产品发布",
        "provenance_type": "SOURCE"
      }
    ],
    "background_atoms": [
      {
        "id": "BG-001",
        "source_reference": "REF-001",
        "purpose": "解释软件验证步骤",
        "claim": "综合和时序分析检查设计能否形成逻辑结构并满足时间约束",
        "provenance_type": "EXTERNAL_BACKGROUND"
      },
      {
        "id": "BG-002",
        "source_reference": "REF-001",
        "purpose": "解释位流",
        "claim": "位流是写入 FPGA 的配置文件",
        "provenance_type": "EXTERNAL_BACKGROUND"
      },
      {
        "id": "BG-003",
        "source_reference": "REF-001",
        "purpose": "解释板级测试新增条件",
        "claim": "开发板测试会引入真实供电、时钟、外设和物理接口",
        "provenance_type": "EXTERNAL_BACKGROUND"
      }
    ],
    "must_preserve": [
      "综合通过",
      "时序分析通过",
      "位流生成",
      "开发板未上电",
      "外设未测试",
      "物理接口未测试",
      "不能批准发布"
    ],
    "must_not_invent": [
      "真实硬件已经工作",
      "产品可以发布",
      "所有时序路径都没有风险",
      "开发板测试一定会通过"
    ],
    "inference_atoms": []
  },
  "candidate": {
    "answer": "## 1. 当前已经完成什么\n\n软件综合和时序分析已经通过；综合把硬件设计转换成 FPGA 可以实现的逻辑结构，时序分析检查这些逻辑在设定时钟约束下能否按时工作；位流也已经生成，位流是准备写入 FPGA 的配置文件\n\n## 2. 当前还没有完成什么\n\n开发板尚未上电；真实供电、时钟、外设和物理接口都没有经过运行测试；软件检查通过只能说明设计已经完成规定的软件处理，不能证明真实硬件环境已经正常工作\n\n```mermaid\nflowchart LR\n    A[综合和时序分析通过] --> B[位流已经生成]\n    B --> C[开发板上电和外设测试尚未开始]\n    C --> D[完成真实硬件测试后才能重新判断是否发布]\n```\n\n图 1. 软件结果与产品发布之间仍缺少的验证步骤\n\n## 3. 现在能够得出什么结论\n\n当前可以保存软件流程和位流生成结果；当前不能批准产品发布；下一步需要在真实开发板上完成上电、外设和物理接口测试，再根据测试证据决定是否发布",
    "support_map": [
      {
        "sentence": 1,
        "supports": [
          "ATOM-001",
          "ATOM-002",
          "BG-001",
          "BG-002"
        ],
        "role": "source_restatement_and_teaching"
      },
      {
        "sentence": 2,
        "supports": [
          "ATOM-003",
          "BG-003"
        ],
        "role": "source_restatement_and_teaching"
      },
      {
        "sentence": 3,
        "supports": [
          "ATOM-004",
          "BG-003"
        ],
        "role": "scope_explanation"
      },
      {
        "sentence": 4,
        "supports": [
          "ATOM-001",
          "ATOM-002",
          "ATOM-003",
          "ATOM-004"
        ],
        "role": "component_explanation"
      },
      {
        "sentence": 5,
        "supports": [
          "ATOM-001",
          "ATOM-002",
          "ATOM-003",
          "ATOM-004"
        ],
        "role": "conclusion_and_next_step"
      }
    ],
    "self_claims": []
  },
  "review": {
    "questions": [
      "零基础读者是否能区分软件流程、位流和真实板卡测试",
      "流程图是否帮助理解，而非重复正文",
      "完成范围、未完成范围和发布结论是否保持原文强度",
      "解释长度是否达到可读与充分之间的平衡"
    ],
    "privacy": {
      "status": "public_safe",
      "basis": "工程状态和背景均为合成 FPGA 教学材料"
    }
  }
}
